{
  "authority_effect": "review_support_only",
  "blocking_issues": [],
  "candidate": {
    "agent_uuid": "15286a2d-5e7f-48e9-b19c-1c2144da0fba",
    "designation": "SPEC-DIAGRAM",
    "product_id": "UDS-CORE-SPECIALIST-CALIBRATION-001"
  },
  "candidate_artifact_hash": "sha256:03e0243a7cf3913646b017350e873caf1878929e19793261cbc30b0ee08946f6",
  "candidate_artifact_id": "1116d7dc-e11e-5479-94e1-e91e223987cd",
  "classification": "public",
  "focus_binding": {
    "profile_hash": "sha256:83d33cf943444f6d6f0ac8b8fa2a6d8934ffa0a20049586f3c7e9a193bbfbfb3",
    "profile_id": "FOCUS-SPEC-DIAGRAM",
    "profile_version": "1.0.0"
  },
  "generated_at": "2026-08-03T23:05:00Z",
  "input_manifest_hash": "sha256:bd9d6fd5c79f01be8c0c9d2e190224e2fcb3675e3168ab4d1be595e97c673d39",
  "input_manifest_id": "477224c1-d482-53c0-8539-75aa57e422fa",
  "items": [
    {
      "allowed_dispositions": [
        "supported",
        "partially_supported",
        "unsupported",
        "duplicate",
        "outside_specialist_scope",
        "unable_to_determine"
      ],
      "confidence": 1.0,
      "confidence_meaning": "confidence in the attributable observation within the declared evidence population",
      "evidence_refs": [
        "EVIDENCE-DIAGRAM-PURPOSE-001"
      ],
      "item_id": "ITEM-0001",
      "kind": "observation",
      "locators": [
        {
          "classification": "public",
          "evidence_id": "EVIDENCE-DIAGRAM-PURPOSE-001",
          "immutable_revision": "329ade01852f9e570d31cb7b19d9979152938c17",
          "line_end": 7,
          "line_fingerprint": "sha256:e3a9cbb803a9351034ca003445c5ccfe2321fef7f1bf2f78964b6429fd6156f1",
          "line_start": 7,
          "locator_hash": "sha256:50f12211b612c00dfd37ffb5ef9fb453bff84ce971a8ccdc554f6dcd64278f12",
          "locator_id": "153b8dcb-349d-5f59-b20d-9787a9cd6765",
          "locator_state": "source_located",
          "path": "docs/.c4/README.md",
          "raw_value_included": false,
          "redaction_applied": false,
          "repository_uri": "https://github.com/defenseunicorns/uds-core.git",
          "reproduction_steps": [
            "Open https://github.com/defenseunicorns/uds-core.git at 329ade01852f9e570d31cb7b19d9979152938c17.",
            "Inspect docs/.c4/README.md line 7.",
            "Compare the safe excerpt and fingerprint."
          ],
          "safe_excerpt": "In UDS Core, we use C4 diagrams to visualize and document our system architecture, including namespaces, components, and their relationships. This helps developers understand how different parts of the system interact with each other.",
          "symbol_or_section": "C4 model purpose"
        }
      ],
      "reviewability": "ready",
      "source_record_id": "OBS-DIAGRAM-001",
      "statement": "The repository states that its C4 model represents namespaces, components, relationships, and interactions."
    },
    {
      "allowed_dispositions": [
        "supported",
        "partially_supported",
        "unsupported",
        "duplicate",
        "outside_specialist_scope",
        "unable_to_determine"
      ],
      "confidence": 0.98,
      "confidence_meaning": "assessment confidence for this bounded specialist finding, not decision confidence",
      "evidence_refs": [
        "EVIDENCE-DIAGRAM-PURPOSE-001"
      ],
      "item_id": "ITEM-0002",
      "kind": "finding",
      "locators": [
        {
          "classification": "public",
          "evidence_id": "EVIDENCE-DIAGRAM-PURPOSE-001",
          "immutable_revision": "329ade01852f9e570d31cb7b19d9979152938c17",
          "line_end": 7,
          "line_fingerprint": "sha256:e3a9cbb803a9351034ca003445c5ccfe2321fef7f1bf2f78964b6429fd6156f1",
          "line_start": 7,
          "locator_hash": "sha256:50f12211b612c00dfd37ffb5ef9fb453bff84ce971a8ccdc554f6dcd64278f12",
          "locator_id": "153b8dcb-349d-5f59-b20d-9787a9cd6765",
          "locator_state": "source_located",
          "path": "docs/.c4/README.md",
          "raw_value_included": false,
          "redaction_applied": false,
          "repository_uri": "https://github.com/defenseunicorns/uds-core.git",
          "reproduction_steps": [
            "Open https://github.com/defenseunicorns/uds-core.git at 329ade01852f9e570d31cb7b19d9979152938c17.",
            "Inspect docs/.c4/README.md line 7.",
            "Compare the safe excerpt and fingerprint."
          ],
          "safe_excerpt": "In UDS Core, we use C4 diagrams to visualize and document our system architecture, including namespaces, components, and their relationships. This helps developers understand how different parts of the system interact with each other.",
          "symbol_or_section": "C4 model purpose"
        }
      ],
      "reviewability": "ready",
      "source_record_id": "FINDING-DIAGRAM-001",
      "statement": "The design-model purpose is declared, but completeness, freshness, consistency, and implementation conformance are not demonstrated."
    },
    {
      "allowed_dispositions": [
        "supported",
        "partially_supported",
        "unsupported",
        "duplicate",
        "outside_specialist_scope",
        "unable_to_determine"
      ],
      "confidence": 0.98,
      "confidence_meaning": "confidence that the recommendation addresses the bounded finding; implementation remains human-owned",
      "evidence_refs": [
        "EVIDENCE-DIAGRAM-PURPOSE-001"
      ],
      "item_id": "ITEM-0003",
      "kind": "recommendation",
      "locators": [
        {
          "classification": "public",
          "evidence_id": "EVIDENCE-DIAGRAM-PURPOSE-001",
          "immutable_revision": "329ade01852f9e570d31cb7b19d9979152938c17",
          "line_end": 7,
          "line_fingerprint": "sha256:e3a9cbb803a9351034ca003445c5ccfe2321fef7f1bf2f78964b6429fd6156f1",
          "line_start": 7,
          "locator_hash": "sha256:50f12211b612c00dfd37ffb5ef9fb453bff84ce971a8ccdc554f6dcd64278f12",
          "locator_id": "153b8dcb-349d-5f59-b20d-9787a9cd6765",
          "locator_state": "source_located",
          "path": "docs/.c4/README.md",
          "raw_value_included": false,
          "redaction_applied": false,
          "repository_uri": "https://github.com/defenseunicorns/uds-core.git",
          "reproduction_steps": [
            "Open https://github.com/defenseunicorns/uds-core.git at 329ade01852f9e570d31cb7b19d9979152938c17.",
            "Inspect docs/.c4/README.md line 7.",
            "Compare the safe excerpt and fingerprint."
          ],
          "safe_excerpt": "In UDS Core, we use C4 diagrams to visualize and document our system architecture, including namespaces, components, and their relationships. This helps developers understand how different parts of the system interact with each other.",
          "symbol_or_section": "C4 model purpose"
        }
      ],
      "reviewability": "ready",
      "source_record_id": "FINDING-DIAGRAM-001:CAPA",
      "statement": "Retain generated diagram outputs, model validation, freshness checks, and implementation mappings."
    },
    {
      "allowed_dispositions": [
        "supported",
        "partially_supported",
        "unsupported",
        "duplicate",
        "outside_specialist_scope",
        "unable_to_determine"
      ],
      "confidence": 1.0,
      "confidence_meaning": "confidence in the stated evidence limitation; no missing value is imputed",
      "evidence_refs": [
        "EVIDENCE-DIAGRAM-PURPOSE-001"
      ],
      "item_id": "ITEM-0004",
      "kind": "unknown",
      "locators": [
        {
          "classification": "public",
          "evidence_id": "EVIDENCE-DIAGRAM-PURPOSE-001",
          "immutable_revision": "329ade01852f9e570d31cb7b19d9979152938c17",
          "line_end": 7,
          "line_fingerprint": "sha256:e3a9cbb803a9351034ca003445c5ccfe2321fef7f1bf2f78964b6429fd6156f1",
          "line_start": 7,
          "locator_hash": "sha256:50f12211b612c00dfd37ffb5ef9fb453bff84ce971a8ccdc554f6dcd64278f12",
          "locator_id": "153b8dcb-349d-5f59-b20d-9787a9cd6765",
          "locator_state": "source_located",
          "path": "docs/.c4/README.md",
          "raw_value_included": false,
          "redaction_applied": false,
          "repository_uri": "https://github.com/defenseunicorns/uds-core.git",
          "reproduction_steps": [
            "Open https://github.com/defenseunicorns/uds-core.git at 329ade01852f9e570d31cb7b19d9979152938c17.",
            "Inspect docs/.c4/README.md line 7.",
            "Compare the safe excerpt and fingerprint."
          ],
          "safe_excerpt": "In UDS Core, we use C4 diagrams to visualize and document our system architecture, including namespaces, components, and their relationships. This helps developers understand how different parts of the system interact with each other.",
          "symbol_or_section": "C4 model purpose"
        }
      ],
      "reviewability": "ready",
      "source_record_id": "UNKNOWN-DIAGRAM-001",
      "statement": "Model completeness, renderability, freshness, and implementation correspondence remain unknown; absence or drift alone is not an implementation defect."
    }
  ],
  "lifecycle": {
    "a100_production_authorized": false,
    "comparison_only": true,
    "deployment_authorized": false,
    "product_fan_in_eligible": false,
    "report_eligible": false,
    "scheduled": false
  },
  "packet_hash": "sha256:1bbb22532021d1db15bc847db94529ec1aba17fc4757c432ceed297bec50b894",
  "packet_id": "e3fb59c4-79e3-538b-bc51-3941d318ee0e",
  "packet_version": "1.0.0",
  "permitted_reviewer_tracks": [
    "general_engineering_intern",
    "qualified_subject_matter_expert",
    "restricted_domain_reviewer"
  ],
  "reviewability_state": "ready_for_human_shadow_review"
}
